{
  "schema_version": 1,
  "issue": {
    "id": "261030-g",
    "published_at": "2026-10-31T00:46:04.872793+09:00",
    "window": {
      "start": "2026-10-30T00:00:00+09:00",
      "end": "2026-10-31T00:00:00+09:00"
    },
    "status": "confirmed",
    "confirmed_at": "2026-10-30T15:48:13+00:00"
  },
  "counts": {
    "items": 302,
    "accounts": 69,
    "late": 21,
    "skipped_duplicate": 3
  },
  "description": "10 月末发售日：escude『廃村少女［弐］外伝』、MOONSTONE 十年新作、ensemble 新作同日开卖",
  "highlights": [
    {
      "text": "エスクード『廃村少女［弐］外伝 ～千艶万匣～』がパッケージ版・DL 版同時に発売、出演声優や原画、CG 監修から祝辞が相次いだ",
      "sources": [
        "x:2115820957571195288",
        "x:2115965951539913108",
        "x:2116008387465146494"
      ]
    },
    {
      "text": "MOONSTONE が 10 年ぶりの新作『ストレイ・シープと死人の恋 Vol.2』を発売、ソフマップ秋葉原でやまかぜ嵐 のサイン会も開いた",
      "sources": [
        "x:2115966085531070862",
        "x:2116093629257363495"
      ]
    },
    {
      "text": "Key『Summer Pockets Sunnyside Stories』の OP ムービーが公開、主題歌は鈴木このみでコーラスに小原好美とファイルーズあい",
      "sources": [
        "x:2116092750546255884"
      ]
    },
    {
      "text": "げっちゅ屋が『Nightmare×BlackSmith』『Dominate』『逆転○○』『転性魔王さまは勇者に勝てない！2』などの予約を一斉に開始",
      "sources": [
        "x:2116050032868889072",
        "x:2116063853532619087"
      ]
    }
  ],
  "insights": [],
  "interactions": [
    {
      "text": "エスクード が『廃村少女［弐］外伝』発売に合わせ、新沼鈴 役の声優や原画担当の祝辞を次々にリポストした",
      "sources": [
        "x:2115965951539913108",
        "x:2116009005982384387"
      ]
    },
    {
      "text": "propeller が他ブランドの新作として ensemble『天獄のヴィネア』の発売を告知した",
      "sources": [
        "x:2116011594463535457"
      ]
    },
    {
      "text": "DESSERT Soft が 10/30 の電妄トークライブ告知を回し、ゲストは ensemble と DESSERT Soft の 2 ブランド",
      "sources": [
        "x:2115998902516355169"
      ]
    }
  ],
  "works": [
    "エスクード『廃村少女［弐］外伝 ～千艶万匣～』がパッケージ版・DL 版ともに本日発売",
    "CIRCUS『D.C.5 to 4 Luminous Memories』が本日発売",
    "ensemble『天獄のヴィネア』が本日発売、修正パッチ ver1.01 も同日公開",
    "MOONSTONE『ストレイ・シープと死人の恋 Vol.2』が本日発売、やまかぜ嵐 のサイン会も開催",
    "あざらしそふと『さくらぶトライアングル』が本日発売、感想キャンペーンとサイン色紙 CP を同時開催",
    "HOOKSOFT『トリプルペアリング ミニファンディスク』が本日発売",
    "ま～まれぇど『スタディ§ステディ』コンプリートパックが本日発売",
    "アパタイト『お口から始まる社内不倫～女上司に絞られて～』のパッケージ版が発売",
    "アパタイト『それでも俺は微乳が好き～巨乳幼馴染の矯正アプローチ～』のパッケージ版が発売",
    "ANIM『壁の向こうの妻の嬌声ｆ』が本日発売、ASMR ボイスドラマも FANZA GAMES で配信",
    "GLOVETY『FORTUNE×WORLD～僕らがゲームを作る理由～』が発売",
    "Lovelet『西園家のかくしゴト - The Secret Revealed by the Lens -』がデビュー作として発売",
    "シルキーズプラス『景の海のアペイリア』コンプリートパック普及版が本日発売",
    "エロチカ『養花師の背徳愛』のパッケージ版が発売、DL 版に続いて",
    "CHAOS-R『血刻継承クレイドペイン ―少女たちの終焉―』の DL 版が発売",
    "TRYSET『調教Selection２』が発売",
    "TRYSET『即ヌキCollection人妻パック』が発売",
    "Miel『異世界孕ませハーレム』が 20%OFF で発売",
    "みるくふぁくとりー『もっと！孕ませ！炎のおっぱい異世界 おっぱいスパイ学園！』の DL 版が配信開始",
    "ルネ『OVAシスターブリーダー #5,#6』が DVD で発売",
    "Key『Summer Pockets Sunnyside Stories』の OP ムービーが公開",
    "FG Remake『遺作リメイク』がマスターアップ、12/25 発売へ",
    "DESSERT Soft『どいなかガールズゆーとぴあ』がマスターアップ、DLsite でも予約開始",
    "Triangle『魔法戦士ソルシエルナイツ』がマスターアップ、11/27 発売へ"
  ],
  "categories": [],
  "accounts": [
    "Moepedia_net",
    "appetite_game",
    "Miel37319007",
    "TRYSET",
    "silkysplus",
    "kiss_staff",
    "atelier__sakura",
    "chaos_R_public",
    "AzarashiSoft",
    "sengoku_kh",
    "HOOKSOFT",
    "CyberworksKoho",
    "Route2_tri",
    "crowd_anim",
    "VALKYRIA_info",
    "escude1998",
    "circus_info",
    "galprince_game",
    "CRYSTALiA_AC",
    "Guilty_WillPlus",
    "smee_official",
    "entergram_info",
    "Amuse_kenzen",
    "key_official",
    "POISON_NEW1992",
    "dessertsoft_tw",
    "Projecti18",
    "PULLTOP_LATTE",
    "u_me_soft",
    "hamham_soft",
    "milkfactory_",
    "FANDC_Staff",
    "will_ensemble",
    "web_marmalade",
    "Amuse_sub",
    "luneman_etc",
    "favo_official",
    "fgremake",
    "SAGAPLANETS",
    "metalogiq",
    "propeller_staff",
    "sprite_fairys",
    "bootUP_twit",
    "alice_soft",
    "CLIP_CRAFT",
    "moonstoneTwitt",
    "nisidahajime",
    "DiGination_info",
    "willplus_staff",
    "KUMANOMISoft",
    "info_9_nine_",
    "fortuneglovety",
    "holic_works",
    "POISON_EX1992",
    "Muvluv_Official",
    "monoceros_plus",
    "keromakurastaff",
    "BEEP_SHOP",
    "info_lovelet",
    "rail_romanesque",
    "adahemas",
    "SukeraSparo",
    "kelp_official",
    "Overflow_staff",
    "nitroplus_staff",
    "seiya_saiga",
    "youtan0309",
    "aikouka23",
    "getchucom"
  ],
  "people": [
    {
      "handle": "Moepedia_net",
      "category": "",
      "summary": "『廃村少女［弐］外伝』と『D.C.5 to 4』の発売を紹介、『聖騎士セルシア』の発売日回顧も",
      "via": [],
      "sources": [
        "x:2116100299387502858",
        "x:2116098576355115088"
      ]
    },
    {
      "handle": "appetite_game",
      "category": "",
      "summary": "『お口から始まる社内不倫』と『それでも俺は微乳が好き』のパッケージ版を同日発売、12/25 作の予約も開始",
      "via": [],
      "sources": [
        "x:2115989286680162626",
        "x:2115990381716447529",
        "x:2116051545137848332"
      ]
    },
    {
      "handle": "Miel37319007",
      "category": "",
      "summary": "『異世界孕ませハーレム』を 20%OFF で発売、過去作は最大 90%OFF のフェスも開催",
      "via": [],
      "sources": [
        "x:2115822136715858024",
        "x:2116088305892966549"
      ]
    },
    {
      "handle": "TRYSET",
      "category": "",
      "summary": "『調教Selection２』と『即ヌキCollection人妻パック』を同時発売",
      "via": [],
      "sources": [
        "x:2115971977945243782"
      ]
    },
    {
      "handle": "silkysplus",
      "category": "",
      "summary": "『景の海のアペイリア』ベスコレ版を発売、17:30 からのキャララにも参加",
      "via": [],
      "sources": [
        "x:2115963482588025212",
        "x:2115962188288713185"
      ]
    },
    {
      "handle": "kiss_staff",
      "category": "",
      "summary": "CRC3D3 クラウドファンディング第2弾が明日最終日、ストレッチゴール第3段階が目前",
      "via": [],
      "sources": [
        "x:2116002168780062762",
        "x:2116092757517402287"
      ]
    },
    {
      "handle": "atelier__sakura",
      "category": "",
      "summary": "『淫獄の放課後２』DVD-PG の発売記念キャンペーンをリポスト",
      "via": [],
      "sources": [
        "x:2116093734760915434"
      ]
    },
    {
      "handle": "chaos_R_public",
      "category": "",
      "summary": "『血刻継承クレイドペイン ―少女たちの終焉―』の DL 版が発売、Ci-en と公式サイトも更新",
      "via": [],
      "sources": [
        "x:2115824762526347693",
        "x:2115844959740018869"
      ]
    },
    {
      "handle": "AzarashiSoft",
      "category": "",
      "summary": "『さくらぶトライアングル』を発売し CP を 2 本開催、『アマカノ』抱き枕の再販も決定",
      "via": [],
      "sources": [
        "x:2116002155450495454",
        "x:2116086454015111225",
        "x:2116009702781764069"
      ]
    },
    {
      "handle": "sengoku_kh",
      "category": "",
      "summary": "『戦国†恋姫BRAVE弐』の双葉 抱き枕カバー、予約は 11/2 で終了",
      "via": [],
      "sources": [
        "x:2115996231952637985"
      ]
    },
    {
      "handle": "HOOKSOFT",
      "category": "",
      "summary": "『トリプルペアリング ミニファンディスク』が本日発売、FANZA GAMES で DL 版を配信中",
      "via": [],
      "sources": [
        "x:2116002163201839568"
      ]
    },
    {
      "handle": "CyberworksKoho",
      "category": "",
      "summary": "TinkerBell『ユメウツツ補習授業』の店舗特典と、WendyBell『夢見るアプリ』の CG 追加を紹介",
      "via": [],
      "sources": [
        "x:2115973451081293835",
        "x:2115973477752774963"
      ]
    },
    {
      "handle": "Route2_tri",
      "category": "",
      "summary": "『魔法戦士ソルシエルナイツ』がマスターアップ、追加特典を決めて 11/27 発売へ",
      "via": [],
      "sources": [
        "x:2116074875043692739"
      ]
    },
    {
      "handle": "crowd_anim",
      "category": "",
      "summary": "『壁の向こうの妻の嬌声ｆ』を発売、ASMR ボイスドラマも配信。『きつ×みこ』のサブキャラも公開",
      "via": [],
      "sources": [
        "x:2115999991458357436",
        "x:2116000109834142054",
        "x:2116000794034286695"
      ]
    },
    {
      "handle": "VALKYRIA_info",
      "category": "",
      "summary": "『三美姫の牝豚～姦獄の城～』の姫騎士アリエスを紹介、『聖騎士セルシア』の発売日回顧も",
      "via": [],
      "sources": [
        "x:2116002157421801976",
        "x:2116095441578439075"
      ]
    },
    {
      "handle": "escude1998",
      "category": "",
      "summary": "『廃村少女［弐］外伝 ～千艶万匣～』のパッケージ版と DL 版を発売、東京と大阪で抽選会も",
      "via": [],
      "sources": [
        "x:2115820957571195288",
        "x:2116009291773808711"
      ]
    },
    {
      "handle": "circus_info",
      "category": "",
      "summary": "『D.C.5 to 4 Luminous Memories』を発売、『DCRe』1周年の 35%OFF セールも開始",
      "via": [],
      "sources": [
        "x:2115840274488545693",
        "x:2116004666064421061"
      ]
    },
    {
      "handle": "galprince_game",
      "category": "",
      "summary": "『さそって☆トレイン２』を FANZA で配信開始、『かなえてダブルウエディング コンプリート』も販売中",
      "via": [],
      "sources": [
        "x:2115973931798822986",
        "x:2115974271357087782"
      ]
    },
    {
      "handle": "CRYSTALiA_AC",
      "category": "",
      "summary": "『Lycee Overture Ver.アミューズクラフト 2.0』が本日発売、自社 2 作のカードも参戦",
      "via": [],
      "sources": [
        "x:2115997881119518738"
      ]
    },
    {
      "handle": "Guilty_WillPlus",
      "category": "",
      "summary": "『Nightmare×BlackSmith』の立ち絵差分を公開して予約開始、『紫幻華』は来週サンプルボイス",
      "via": [],
      "sources": [
        "x:2116063821252984953",
        "x:2116071173213864214"
      ]
    },
    {
      "handle": "smee_official",
      "category": "",
      "summary": "『ワンナイトアフター』11/27 発売に向け、店舗特典と PR カードの情報を公開",
      "via": [],
      "sources": [
        "x:2116009698411651174",
        "x:2116009949755019535"
      ]
    },
    {
      "handle": "entergram_info",
      "category": "",
      "summary": "秋葉原のトレーダー2号店前に「でかパト」が出ていると報告",
      "via": [],
      "sources": [
        "x:2115930426308989246"
      ]
    },
    {
      "handle": "Amuse_kenzen",
      "category": "",
      "summary": "『養花師の背徳愛』のパッケージ版を発売、秋葉原と大阪で配布イベントを開催",
      "via": [],
      "sources": [
        "x:2116004665464942874",
        "x:2116081932975169705"
      ]
    },
    {
      "handle": "key_official",
      "category": "",
      "summary": "『Summer Pockets Sunnyside Stories』の OP ムービーを公開、主題歌は鈴木このみ",
      "via": [],
      "sources": [